{"$schema":"https://json-schema.org/draft/2020-12/schema","type":"object","additionalProperties":false,"required":["schema_version","provider","model_id","endpoint","channel","text_only","vision_enabled","video_enabled","files_enabled","web_enabled","tools_enabled","parallel_enabled","fallback_enabled","max_provider_calls","max_retries","max_input_tokens","max_output_tokens","operation_timeout_seconds","run_deadline_seconds","monetary_budget_status","monetary_budget_limit","pricing_source","approval_state"],"properties":{"schema_version":{"const":"dr-canary-plan-v1"},"provider":{"const":"zhipu-bigmodel"},"model_id":{"const":"glm-5.3-flash"},"endpoint":{"const":"https://open.bigmodel.cn/api/paas/v4/chat/completions"},"channel":{"const":"ordinary_model_api"},"text_only":{"const":true},"vision_enabled":{"const":false},"video_enabled":{"const":false},"files_enabled":{"const":false},"web_enabled":{"const":false},"tools_enabled":{"const":false},"parallel_enabled":{"const":false},"fallback_enabled":{"const":false},"max_provider_calls":{"const":1},"max_retries":{"const":0},"max_input_tokens":{"const":512},"max_output_tokens":{"const":256},"operation_timeout_seconds":{"const":30},"run_deadline_seconds":{"const":45},"monetary_budget_status":{"const":"blocked_pending_official_pricing"},"monetary_budget_limit":{"type":"null"},"pricing_source":{"type":"null"},"approval_state":{"const":"plan_only_pending_user_execute_authorization"}}}
