{"schema_version":"dr-canary-plan-v1","provider":"zhipu-bigmodel","model_id":"glm-5.3-flash","endpoint":"https://open.bigmodel.cn/api/paas/v4/chat/completions","channel":"ordinary_model_api","text_only":true,"vision_enabled":false,"video_enabled":false,"files_enabled":false,"web_enabled":false,"tools_enabled":false,"parallel_enabled":false,"fallback_enabled":false,"max_provider_calls":1,"max_retries":0,"max_input_tokens":512,"max_output_tokens":256,"operation_timeout_seconds":30,"run_deadline_seconds":45,"monetary_budget_status":"blocked_pending_official_pricing","monetary_budget_limit":null,"pricing_source":null,"approval_state":"plan_only_pending_user_execute_authorization"}
